[
  {
    "id": "youtube-transcript",
    "name": "YouTube Transcript",
    "type": "tool",
    "categories": ["research", "productivity"],
    "summary": "Legacy listing for fetching YouTube transcripts. Implementation is not available at the linked source.",
    "source": "https://github.com/newnol/openwebui-extension",
    "guide": "https://github.com/newnol/openwebui-extension",
    "status": "unavailable",
    "reviewed": "2026-10-27",
    "evidence": "https://api.github.com/repos/newnol/openwebui-extension/git/trees/7708ffdf65a3396d5dd50b8a2eec66f5f10ca356",
    "review_note": "The linked default-branch tree contains README, LICENSE and .gitignore only; no installable implementation was found. Legacy listing retained, not recommended for installation.",
    "compatibility": "Unknown; no runtime test.",
    "requirements": ["Implementation and setup instructions not published"],
    "risk": "Do not install code from unrelated mirrors to fill this missing implementation.",
    "license": "See upstream license and service terms."
  },
  {
    "id": "youtube-info",
    "name": "YouTube Info",
    "type": "tool",
    "categories": ["research"],
    "summary": "Legacy listing for YouTube titles and descriptions. Implementation is not available at the linked source.",
    "source": "https://github.com/newnol/openwebui-extension",
    "guide": "https://github.com/newnol/openwebui-extension",
    "status": "unavailable",
    "reviewed": "2026-10-27",
    "evidence": "https://api.github.com/repos/newnol/openwebui-extension/git/trees/7708ffdf65a3396d5dd50b8a2eec66f5f10ca356",
    "review_note": "The linked default-branch tree contains README, LICENSE and .gitignore only; no installable implementation was found. Legacy listing retained, not recommended for installation.",
    "compatibility": "Unknown; no runtime test.",
    "requirements": ["Implementation and browser dependencies not published"],
    "risk": "Do not install code from unrelated mirrors to fill this missing implementation.",
    "license": "See upstream license and service terms."
  },
  {
    "id": "diagram-generator",
    "name": "Diagram Generator",
    "type": "tool",
    "categories": ["coding", "productivity"],
    "summary": "Legacy listing for architecture diagrams. Implementation is not available at the linked source.",
    "source": "https://github.com/newnol/openwebui-extension",
    "guide": "https://github.com/newnol/openwebui-extension",
    "status": "unavailable",
    "reviewed": "2026-10-27",
    "evidence": "https://api.github.com/repos/newnol/openwebui-extension/git/trees/7708ffdf65a3396d5dd50b8a2eec66f5f10ca356",
    "review_note": "The linked default-branch tree contains README, LICENSE and .gitignore only; no installable implementation was found. Legacy listing retained, not recommended for installation.",
    "compatibility": "Unknown; no runtime test.",
    "requirements": ["Implementation and Graphviz requirements need verification"],
    "risk": "Do not install code from unrelated mirrors to fill this missing implementation.",
    "license": "See upstream license and service terms."
  },
  {
    "id": "auto-tool-filter",
    "name": "Auto Tool Filter",
    "type": "tool",
    "categories": ["multi-agent", "automation"],
    "summary": "Legacy listing for automatic tool selection. Artifact type and implementation need verification.",
    "source": "https://github.com/newnol/openwebui-extension",
    "guide": "https://github.com/newnol/openwebui-extension",
    "status": "unavailable",
    "reviewed": "2026-10-27",
    "evidence": "https://api.github.com/repos/newnol/openwebui-extension/git/trees/7708ffdf65a3396d5dd50b8a2eec66f5f10ca356",
    "review_note": "The linked default-branch tree contains README, LICENSE and .gitignore only; no installable implementation was found. Legacy listing retained, not recommended for installation.",
    "compatibility": "Unknown; no runtime test.",
    "requirements": ["Implementation and artifact type need verification"],
    "risk": "Do not install code from unrelated mirrors to fill this missing implementation.",
    "license": "See upstream license and service terms."
  },
  {
    "id": "auto-router-model",
    "name": "Auto Router Model",
    "type": "pipe",
    "categories": ["multi-agent", "automation"],
    "summary": "Legacy listing for model routing. Implementation is not available at the linked source.",
    "source": "https://github.com/newnol/openwebui-extension",
    "guide": "https://github.com/newnol/openwebui-extension",
    "status": "unavailable",
    "reviewed": "2026-10-27",
    "evidence": "https://api.github.com/repos/newnol/openwebui-extension/git/trees/7708ffdf65a3396d5dd50b8a2eec66f5f10ca356",
    "review_note": "The linked default-branch tree contains README, LICENSE and .gitignore only; no installable implementation was found. Legacy listing retained, not recommended for installation.",
    "compatibility": "Unknown; no runtime test.",
    "requirements": ["Implementation and provider configuration not published"],
    "risk": "Do not install code from unrelated mirrors to fill this missing implementation.",
    "license": "See upstream license and service terms."
  },
  {
    "id": "sheetproof",
    "name": "SheetProof",
    "type": "tool",
    "categories": ["productivity"],
    "summary": "Analyze CSV and Excel uploads using computed pandas results and provenance.",
    "source": "https://github.com/Almehmadi-Ai/sheetproof",
    "guide": "https://github.com/Almehmadi-Ai/sheetproof#installation",
    "status": "documented",
    "reviewed": "2026-10-27",
    "evidence": "https://github.com/Almehmadi-Ai/sheetproof#installation",
    "review_note": "Upstream README and installation instructions inspected. Arithmetic and security claims have not been independently tested.",
    "compatibility": "Upstream README states Open WebUI 0.5.0+; not independently runtime-tested.",
    "requirements": ["Open WebUI administrator access", "Tool-capable model", "pandas, numpy, openpyxl and xlrd; see upstream versions"],
    "risk": "Server-side Python reads uploaded files. Tool results may be sent to your selected model provider.",
    "license": "MIT, as stated upstream."
  },
  {
    "id": "sheetproof-router",
    "name": "SheetProof Router",
    "type": "function",
    "categories": ["productivity", "security"],
    "summary": "Companion filter that routes spreadsheet chats to SheetProof and audits reported figures.",
    "source": "https://github.com/Almehmadi-Ai/sheetproof",
    "guide": "https://github.com/Almehmadi-Ai/sheetproof#installation",
    "status": "documented",
    "reviewed": "2026-10-27",
    "evidence": "https://github.com/Almehmadi-Ai/sheetproof#installation",
    "review_note": "Upstream documents a separate filter and setup. Requires the companion tool; not a standalone spreadsheet engine.",
    "compatibility": "Upstream README states Open WebUI 0.5.0+; not independently runtime-tested.",
    "requirements": ["SheetProof tool", "Administrator permission to install a filter"],
    "risk": "Server-side filter changes retrieval and tool selection. Audit warnings are not a guarantee of correct answers.",
    "license": "MIT, as stated upstream."
  },
  {
    "id": "openwebui-stack",
    "name": "Open WebUI reference stack",
    "type": "stack",
    "categories": ["self-hosting", "coding"],
    "summary": "Compose example combining Open WebUI, LiteLLM, Open Terminal and PostgreSQL.",
    "source": "https://github.com/newnol/awesome-openwebui-stack/tree/main/stacks/openwebui-stack",
    "guide": "https://github.com/newnol/awesome-openwebui-stack/tree/main/stacks/openwebui-stack#quick-start-run-open-webui-in-a-few-minutes",
    "status": "example",
    "reviewed": "2026-10-27",
    "evidence": "https://github.com/newnol/awesome-openwebui-stack/tree/main/stacks/openwebui-stack#quick-start-run-open-webui-in-a-few-minutes",
    "review_note": "Example infrastructure, not a production-ready or security-audited distribution.",
    "compatibility": "Compose inspected only; no end-to-end deployment test.",
    "requirements": ["Docker Compose v2", "Provider credentials as needed", "Review .env and external network configuration"],
    "risk": "Example exposes service ports and contains fallback secrets. Harden before shared or internet-facing deployment.",
    "license": "Repository MIT; component licenses are separate."
  },
  {
    "id": "litellm",
    "name": "LiteLLM",
    "type": "integration",
    "categories": ["self-hosting", "automation"],
    "summary": "Connect model providers through an OpenAI-compatible proxy endpoint.",
    "source": "https://github.com/BerriAI/litellm",
    "guide": "https://docs.openwebui.com/getting-started/quick-start/connect-a-provider/starting-with-openai-compatible/",
    "status": "documented",
    "reviewed": "2026-10-27",
    "evidence": "https://docs.openwebui.com/getting-started/quick-start/connect-a-provider/starting-with-openai-compatible/",
    "review_note": "Open WebUI provider documentation describes the LiteLLM connection.",
    "compatibility": "Use the OpenAI-compatible connection guide for your version; no runtime test.",
    "requirements": ["Reachable LiteLLM proxy", "Provider credentials for hosted models", "Open WebUI admin connection"],
    "risk": "Requests and credentials pass through the proxy. Restrict administrative keys and review provider data handling.",
    "license": "See upstream license and service terms."
  },
  {
    "id": "ollama",
    "name": "Ollama",
    "type": "integration",
    "categories": ["self-hosting"],
    "summary": "Connect a local model server through Open WebUI's Ollama connection.",
    "source": "https://github.com/ollama/ollama",
    "guide": "https://docs.openwebui.com/getting-started/quick-start/connect-a-provider/starting-with-ollama/",
    "status": "documented",
    "reviewed": "2026-10-27",